summary_code,detail_code,detail_description
111CA,1111A0,Oilseed farming
111CA,1111B0,Grain farming
111CA,111200,Vegetable and melon farming
111CA,111300,Fruit and tree nut farming
111CA,111400,"Greenhouse, nursery, and floriculture production"
111CA,111900,Other crop farming
111CA,112120,Dairy cattle and milk production
111CA,1121A0,"Beef cattle ranching and farming, including feedlots and dual-purpose ranching and farming"
111CA,112300,Poultry and egg production
111CA,112A00,"Animal production, except cattle and poultry and eggs"
113FF,113000,Forestry and logging
113FF,114000,"Fishing, hunting and trapping"
113FF,115000,Support activities for agriculture and forestry
211,211000,Oil and gas extraction
212,212100,Coal mining
212,212230,"Copper, nickel, lead, and zinc mining"
212,2122A0,"Iron, gold, silver, and other metal ore mining"
212,212310,Stone mining and quarrying
212,2123A0,Other nonmetallic mineral mining and quarrying
213,213111,Drilling oil and gas wells
213,21311A,Other support activities for mining
22,221100,"Electric power generation, transmission, and distribution"
22,221200,Natural gas distribution
22,221300,"Water, sewage and other systems"
23,230301,Nonresidential maintenance and repair
23,230302,Residential maintenance and repair
23,233210,Health care structures
23,233230,Manufacturing structures
23,233240,Power and communication structures
23,233262,Educational and vocational structures
23,2332A0,Office and commercial structures
23,2332C0,Transportation structures and highways and streets
23,2332D0,Other nonresidential structures
23,233411,Single-family residential structures
23,233412,Multifamily residential structures
23,2334A0,Other residential structures
311FT,311111,Dog and cat food manufacturing
311FT,311119,Other animal food manufacturing
311FT,311210,Flour milling and malt manufacturing
311FT,311221,Wet corn milling
311FT,311224,Soybean and other oilseed processing
311FT,311225,Fats and oils refining and blending
311FT,311230,Breakfast cereal manufacturing
311FT,311300,Sugar and confectionery product manufacturing
311FT,311410,Frozen food manufacturing
311FT,311420,"Fruit and vegetable canning, pickling, and drying"
311FT,311513,Cheese manufacturing
311FT,311514,"Dry, condensed, and evaporated dairy product manufacturing"
311FT,31151A,Fluid milk and butter manufacturing
311FT,311520,Ice cream and frozen dessert manufacturing
311FT,311615,Poultry processing
311FT,31161A,"Animal (except poultry) slaughtering, rendering, and processing"
311FT,311700,Seafood product preparation and packaging
311FT,311810,Bread and bakery product manufacturing
311FT,3118A0,"Cookie, cracker, pasta, and tortilla manufacturing"
311FT,311910,Snack food manufacturing
311FT,311920,Coffee and tea manufacturing
311FT,311930,Flavoring syrup and concentrate manufacturing
311FT,311940,Seasoning and dressing manufacturing
311FT,311990,All other food manufacturing
311FT,312110,Soft drink and ice manufacturing
311FT,312120,Breweries
311FT,312130,Wineries
311FT,312140,Distilleries
311FT,312200,Tobacco manufacturing
313TT,313100,"Fiber, yarn, and thread mills"
313TT,313200,Fabric mills
313TT,313300,Textile and fabric finishing and fabric coating mills
313TT,314110,Carpet and rug mills
313TT,314120,Curtain and linen mills
313TT,314900,Other textile product mills
315AL,315000,Apparel manufacturing
315AL,316000,Leather and allied product manufacturing
321,321100,Sawmills and wood preservation
321,321200,"Veneer, plywood, and engineered wood product manufacturing"
321,321910,Millwork
321,3219A0,All other wood product manufacturing
322,322110,Pulp mills
322,322120,Paper mills
322,322130,Paperboard mills
322,322210,Paperboard container manufacturing
322,322220,Paper bag and coated and treated paper manufacturing
322,322230,Stationery product manufacturing
322,322291,Sanitary paper product manufacturing
322,322299,All other converted paper product manufacturing
323,323110,Printing
323,323120,Support activities for printing
324,324110,Petroleum refineries
324,324121,Asphalt paving mixture and block manufacturing
324,324122,Asphalt shingle and coating materials manufacturing
324,324190,Other petroleum and coal products manufacturing
325,325110,Petrochemical manufacturing
325,325120,Industrial gas manufacturing
325,325130,Synthetic dye and pigment manufacturing
325,325180,Other basic inorganic chemical manufacturing
325,325190,Other basic organic chemical manufacturing
325,325211,Plastics material and resin manufacturing
325,3252A0,Synthetic rubber and artificial and synthetic fibers and filaments manufacturing
325,325310,Fertilizer manufacturing
325,325320,Pesticide and other agricultural chemical manufacturing
325,325411,Medicinal and botanical manufacturing
325,325412,Pharmaceutical preparation manufacturing
325,325413,In-vitro diagnostic substance manufacturing
325,325414,Biological product (except diagnostic) manufacturing
325,325510,Paint and coating manufacturing
325,325520,Adhesive manufacturing
325,325610,Soap and cleaning compound manufacturing
325,325620,Toilet preparation manufacturing
325,325910,Printing ink manufacturing
325,3259A0,All other chemical product and preparation manufacturing
326,326110,Plastics packaging materials and unlaminated film and sheet manufacturing
326,326120,"Plastics pipe, pipe fitting, and unlaminated profile shape manufacturing"
326,326130,"Laminated plastics plate, sheet (except packaging), and shape manufacturing"
326,326140,Polystyrene foam product manufacturing
326,326150,Urethane and other foam product (except polystyrene) manufacturing
326,326160,Plastics bottle manufacturing
326,326190,Other plastics product manufacturing
326,326210,Tire manufacturing
326,326220,Rubber and plastics hoses and belting manufacturing
326,326290,Other rubber product manufacturing
327,327100,Clay product and refractory manufacturing
327,327200,Glass and glass product manufacturing
327,327310,Cement manufacturing
327,327320,Ready-mix concrete manufacturing
327,327330,"Concrete pipe, brick, and block manufacturing"
327,327390,Other concrete product manufacturing
327,327400,Lime and gypsum product manufacturing
327,327910,Abrasive product manufacturing
327,327991,Cut stone and stone product manufacturing
327,327992,Ground or treated mineral and earth manufacturing
327,327993,Mineral wool manufacturing
327,327999,Miscellaneous nonmetallic mineral products
331,331110,Iron and steel mills and ferroalloy manufacturing
331,331200,Steel product manufacturing from purchased steel
331,331313,Alumina refining and primary aluminum production
331,331314,Secondary smelting and alloying of aluminum
331,33131B,Aluminum product manufacturing from purchased aluminum
331,331410,Nonferrous metal (except aluminum) smelting and refining
331,331420,"Copper rolling, drawing, extruding and alloying"
331,331490,"Nonferrous metal (except copper and aluminum) rolling, drawing, extruding and alloying"
331,331510,Ferrous metal foundries
331,331520,Nonferrous metal foundries
332,332114,Custom roll forming
332,332119,"Metal crown, closure, and other metal stamping (except automotive)"
332,33211A,"All other forging, stamping, and sintering"
332,332200,Cutlery and handtool manufacturing
332,332310,Plate work and fabricated structural product manufacturing
332,332320,Ornamental and architectural metal products manufacturing
332,332410,Power boiler and heat exchanger manufacturing
332,332420,Metal tank (heavy gauge) manufacturing
332,332430,"Metal can, box, and other metal container (light gauge) manufacturing"
332,332500,Hardware manufacturing
332,332600,Spring and wire product manufacturing
332,332710,Machine shops
332,332720,"Turned product and screw, nut, and bolt manufacturing"
332,332800,"Coating, engraving, heat treating and allied activities"
332,332913,Plumbing fixture fitting and trim manufacturing
332,33291A,Valve and fittings other than plumbing
332,332991,Ball and roller bearing manufacturing
332,332996,Fabricated pipe and pipe fitting manufacturing
332,332999,Other fabricated metal manufacturing
332,33299A,"Ammunition, arms, ordnance, and accessories manufacturing"
333,333111,Farm machinery and equipment manufacturing
333,333112,Lawn and garden equipment manufacturing
333,333120,Construction machinery manufacturing
333,333130,Mining and oil and gas field machinery manufacturing
333,333242,Semiconductor machinery manufacturing
333,33329A,Other industrial machinery manufacturing
333,333314,Optical instrument and lens manufacturing
333,333316,Photographic and photocopying equipment manufacturing
333,333318,Other commercial and service industry machinery manufacturing
333,333413,Industrial and commercial fan and blower and air purification equipment manufacturing
333,333414,Heating equipment (except warm air furnaces) manufacturing
333,333415,"Air conditioning, refrigeration, and warm air heating equipment manufacturing"
333,333511,Industrial mold manufacturing
333,333514,"Special tool, die, jig, and fixture manufacturing"
333,333517,Machine tool manufacturing
333,33351B,"Cutting and machine tool accessory, rolling mill, and other metalworking machinery manufacturing"
333,333611,Turbine and turbine generator set units manufacturing
333,333612,"Speed changer, industrial high-speed drive, and gear manufacturing"
333,333613,Mechanical power transmission equipment manufacturing
333,333618,Other engine equipment manufacturing
333,333912,Air and gas compressor manufacturing
333,333914,"Measuring, dispensing, and other pumping equipment manufacturing"
333,333920,Material handling equipment manufacturing
333,333991,Power-driven handtool manufacturing
333,333993,Packaging machinery manufacturing
333,333994,Industrial process furnace and oven manufacturing
333,33399A,Other general purpose machinery manufacturing
333,33399B,Fluid power process machinery
334,334111,Electronic computer manufacturing
334,334112,Computer storage device manufacturing
334,334118,Computer terminals and other computer peripheral equipment manufacturing
334,334210,Telephone apparatus manufacturing
334,334220,Broadcast and wireless communications equipment
334,334290,Other communications equipment manufacturing
334,334300,Audio and video equipment manufacturing
334,334413,Semiconductor and related device manufacturing
334,334418,Printed circuit assembly (electronic assembly) manufacturing
334,33441A,Other electronic component manufacturing
334,334510,Electromedical and electrotherapeutic apparatus manufacturing
334,334511,"Search, detection, and navigation instruments manufacturing"
334,334512,Automatic environmental control manufacturing
334,334513,Industrial process variable instruments manufacturing
334,334514,Totalizing fluid meter and counting device manufacturing
334,334515,Electricity and signal testing instruments manufacturing
334,334516,Analytical laboratory instrument manufacturing
334,334517,Irradiation apparatus manufacturing
334,33451A,"Watch, clock, and other measuring and controlling device manufacturing"
334,334610,Manufacturing and reproducing magnetic and optical media
335,335110,Electric lamp bulb and part manufacturing
335,335120,Lighting fixture manufacturing
335,335210,Small electrical appliance manufacturing
335,335220,Major household appliance manufacturing
335,335311,"Power, distribution, and specialty transformer manufacturing"
335,335312,Motor and generator manufacturing
335,335313,Switchgear and switchboard apparatus manufacturing
335,335314,Relay and industrial control manufacturing
335,335911,Storage battery manufacturing
335,335912,Primary battery manufacturing
335,335920,Communication and energy wire and cable manufacturing
335,335930,Wiring device manufacturing
335,335991,Carbon and graphite product manufacturing
335,335999,All other miscellaneous electrical equipment and component manufacturing
3361MV,336111,Automobile manufacturing
3361MV,336112,Light truck and utility vehicle manufacturing
3361MV,336120,Heavy duty truck manufacturing
3361MV,336211,Motor vehicle body manufacturing
3361MV,336212,Truck trailer manufacturing
3361MV,336213,Motor home manufacturing
3361MV,336214,Travel trailer and camper manufacturing
3361MV,336310,Motor vehicle gasoline engine and engine parts manufacturing
3361MV,336320,Motor vehicle electrical and electronic equipment manufacturing
3361MV,336350,Motor vehicle transmission and power train parts manufacturing
3361MV,336360,Motor vehicle seating and interior trim manufacturing
3361MV,336370,Motor vehicle metal stamping
3361MV,336390,Other motor vehicle parts manufacturing
3361MV,3363A0,"Motor vehicle steering, suspension component (except spring), and brake systems manufacturing"
3364OT,336411,Aircraft manufacturing
3364OT,336412,Aircraft engine and engine parts manufacturing
3364OT,336413,Other aircraft parts and auxiliary equipment manufacturing
3364OT,336414,Guided missile and space vehicle manufacturing
3364OT,33641A,Propulsion units and parts for space vehicles and guided missiles
3364OT,336500,Railroad rolling stock manufacturing
3364OT,336611,Ship building and repairing
3364OT,336612,Boat building
3364OT,336991,"Motorcycle, bicycle, and parts manufacturing"
3364OT,336992,"Military armored vehicle, tank, and tank component manufacturing"
3364OT,336999,All other transportation equipment manufacturing
337,337110,Wood kitchen cabinet and countertop manufacturing
337,337121,Upholstered household furniture manufacturing
337,337122,Nonupholstered wood household furniture manufacturing
337,337127,Institutional furniture manufacturing
337,33712N,Other household nonupholstered furniture
337,337215,"Showcase, partition, shelving, and locker manufacturing"
337,33721A,Office furniture and custom architectural woodwork and millwork manufacturing
337,337900,Other furniture related product manufacturing
339,339112,Surgical and medical instrument manufacturing
339,339113,Surgical appliance and supplies manufacturing
339,339114,Dental equipment and supplies manufacturing
339,339115,Ophthalmic goods manufacturing
339,339116,Dental laboratories
339,339910,Jewelry and silverware manufacturing
339,339920,Sporting and athletic goods manufacturing
339,339930,"Doll, toy, and game manufacturing"
339,339940,Office supplies (except paper) manufacturing
339,339950,Sign manufacturing
339,339990,All other miscellaneous manufacturing
42,4200ID,Customs duties
42,423100,Motor vehicle and motor vehicle parts and supplies
42,423400,Professional and commercial equipment and supplies
42,423600,Household appliances and electrical and electronic goods
42,423800,"Machinery, equipment, and supplies"
42,423A00,Other durable goods merchant wholesalers
42,424200,Drugs and druggists' sundries
42,424400,Grocery and related product wholesalers
42,424700,Petroleum and petroleum products
42,424A00,Other nondurable goods merchant wholesalers
42,425000,Wholesale electronic markets and agents and brokers
441,441000,Motor vehicle and parts dealers
4A0,444000,Building material and garden equipment and supplies dealers
445,445000,Food and beverage stores
4A0,446000,Health and personal care stores
4A0,447000,Gasoline stations
4A0,448000,Clothing and clothing accessories stores
452,452000,General merchandise stores
4A0,454000,Nonstore retailers
481,481000,Air transportation
482,482000,Rail transportation
483,483000,Water transportation
484,484000,Truck transportation
485,485000,Transit and ground passenger transportation
486,486000,Pipeline transportation
487OS,48A000,Scenic and sightseeing transportation and support activities
GFE,491000,Postal service
487OS,492000,Couriers and messengers
493,493000,Warehousing and storage
4A0,4B0000,All other retail
511,511110,Newspaper publishers
511,511120,Periodical publishers
511,511130,Book publishers
511,5111A0,"Directory, mailing list, and other publishers"
511,511200,Software publishers
512,512100,Motion picture and video industries
512,512200,Sound recording industries
513,515100,Radio and television broadcasting
513,515200,Cable and other subscription programming
513,517110,Wired telecommunications carriers
513,517210,Wireless telecommunications carriers (except satellite)
513,517A00,"Satellite, telecommunications resellers, and all other telecommunications"
514,518200,"Data processing, hosting, and related services"
514,519130,Internet publishing and broadcasting and Web search portals
514,5191A0,"News syndicates, libraries, archives and all other information services"
521CI,522A00,Nondepository credit intermediation and related activities
523,523900,Other financial investment activities
523,523A00,Securities and commodity contracts intermediation and brokerage
524,524113,Direct life insurance carriers
524,5241XX,"Insurance carriers, except direct life"
524,524200,"Insurance agencies, brokerages, and related activities"
525,525000,"Funds, trusts, and other financial vehicles"
521CI,52A000,Monetary authorities and depository credit intermediation
HS,531HSO,Owner-occupied housing
HS,531HST,Tenant-occupied housing
ORE,531ORE,Other real estate
532RL,532100,Automotive equipment rental and leasing
532RL,532400,Commercial and industrial machinery and equipment rental and leasing
532RL,532A00,General and consumer goods rental
532RL,533000,Lessors of nonfinancial intangible assets
5411,541100,Legal services
5412OP,541200,"Accounting, tax preparation, bookkeeping, and payroll services"
5412OP,541300,"Architectural, engineering, and related services"
5412OP,541400,Specialized design services
5415,541511,Custom computer programming services
5415,541512,Computer systems design services
5415,54151A,"Other computer related services, including facilities management"
5412OP,541610,Management consulting services
5412OP,5416A0,Environmental and other technical consulting services
5412OP,541700,Scientific research and development services
5412OP,541800,"Advertising, public relations, and related services"
5412OP,541920,Photographic services
5412OP,541940,Veterinary services
5412OP,5419A0,"All other miscellaneous professional, scientific, and technical services"
55,550000,Management of companies and enterprises
561,561100,Office administrative services
561,561200,Facilities support services
561,561300,Employment services
561,561400,Business support services
561,561500,Travel arrangement and reservation services
561,561600,Investigation and security services
561,561700,Services to buildings and dwellings
561,561900,Other support services
562,562000,Waste management and remediation services
61,611100,Elementary and secondary schools
61,611A00,"Junior colleges, colleges, universities, and professional schools"
61,611B00,Other educational services
621,621100,Offices of physicians
621,621200,Offices of dentists
621,621300,Offices of other health practitioners
621,621400,Outpatient care centers
621,621500,Medical and diagnostic laboratories
621,621600,Home health care services
621,621900,Other ambulatory health care services
622,622000,Hospitals
623,623A00,Nursing and community care facilities
623,623B00,"Residential mental health, substance abuse, and other residential care facilities"
624,624100,Individual and family services
624,624400,Child day care services
624,624A00,"Community food, housing, and other relief services, including vocational rehabilitation services"
711AS,711100,Performing arts companies
711AS,711200,Spectator sports
711AS,711500,"Independent artists, writers, and performers"
711AS,711A00,Promoters of performing arts and sports and agents for public figures
711AS,712000,"Museums, historical sites, zoos, and parks"
713,713100,Amusement parks and arcades
713,713200,Gambling industries (except casino hotels)
713,713900,Other amusement and recreation industries
721,721000,Accommodation
722,722110,Full-service restaurants
722,722211,Limited-service restaurants
722,722A00,All other food and drinking places
81,811100,Automotive repair and maintenance (including car washes)
81,811200,Electronic and precision equipment repair and maintenance
81,811300,Commercial and industrial machinery and equipment repair and maintenance
81,811400,Personal and household goods repair and maintenance
81,812100,Personal care services
81,812200,Death care services
81,812300,Dry-cleaning and laundry services
81,812900,Other personal services
81,813100,Religious organizations
81,813A00,"Grantmaking, giving, and social advocacy organizations"
81,813B00,"Civic, social, professional, and similar organizations"
81,814000,Private households
GSLG,GSLGE,State and local government (educational services)
GSLG,GSLGH,State and local government (hospitals and health services)
GSLG,GSLGO,State and local government (other services)
GFE,S00101,Federal electric utilities
GFE,S00102,Other federal government enterprises
GSLE,S00201,State and local government passenger transit
GSLE,S00202,State and local government electric utilities
GSLE,S00203,Other state and local government enterprises
Other,S00300,Noncomparable imports
Used,S00401,Scrap
Used,S00402,Used and secondhand goods
GFGD,S00500,Federal general government (defense)
GFGN,S00600,Federal general government (nondefense)
Other,S00900,Rest of the world adjustment
